index,Title,Score,Number_Of_Comments,Publish_Date,Content,Category,PreProcessedContent,PreProcessedTitle
0,Introducing the world’s worst catfish,53490,609,24/04/2019,[ Removed by reddit in response to a copyright notice. ],catfish,removed reddit response copyright notice,introducing worlds worst catfish
1,robbed by my date this morning..,16269,1499,19/05/2022,"Update #5 June 3rd the entirety of my money has been refunded to me today and the police have all of the information they need and have put out a warrant for stealing both my debit and credit card which is a felony warrant and then the county where my card was used put out a retail fraud warrant for her stealing merchandise after a failed attempt at using my card, not sure if they will actually contact me when she's finally captured but I'm sure I will have to appear in court

Update #4

This all happened the morning of the 19th or 20th, can't recall exactly, whatever day this post was made..

Today is the 28th, I've spoken with the detective the last two days and he's gone to every location my cards were used at and has viewed the security footage so all that business is over with, they've put felony warrants out for her arrest, 

Yesterday an officer from the county the Walmart is located in contacted me and asked if I could also share the information about the theif because on her last attempt to use my card after it was locked she walked out of the store with all of their merchandise she couldn't pay for which was over 100$ in product so they will also be bringing separate charges up against her for that,

She purchased a Greyhound ticket with my card so chances are she's not even in this state anymore and they said the charges would not be extraditable so she won't get picked up there and brought back here but if she ever comes back she's probably got a prison sentence waiting for her since she already has multiple felony theft charges, this is probably the end of the story until that finally happens



Update#3 

30 minutes after update 2 an actual detective from the bureau of investigation contacted me and said by Wednesday he will be stopping at every location a transaction was made and reviewing the footage of every single transaction and she will 100% have at least one felony warrant, 

He said if she did end up taking the Greyhound out of state unfortunately the warrant will not be extraditable but if she ever returns to Michigan which she has children and family here it will catch up to her eventually, 



Update #2

Spoke with Walmart again today they said the detective tried to contact them but they missed the call and have kind of been going back and forth playing phone tag,

The security manager gave me her direct line to email to the officer so that should help,

She said she has footage from each transaction ready for the police to come collect and told me it was the same individual each time using my stolen card and that they also have footage of the vehicle, 

My bank told me they need a copy of the police report in order to credit me the money that was stolen and I guess it's not as simple as just going down to the station and requesting it, I have to email the Police department and request that it be sent to the police department for me to pick up then I have to pay around $10 for it which I'm fine with.

The lady was kind of rude and said it would only contain whatever they have investigated so far like it was a waste of time for me and I told her I didn't really care because I need it to send to my bank so I can get my money back. 






Update, I'm the guy who's debit card was stolen by a tinder date yesterday, 

I invited a girl over for dinner drinks and a movie, woke up and she was gone which I was fine with. Checked my phone to see what time it was and noticed multiple transactions I didn't recognize.

Immediately canceled my card and reported it stolen, they said my funds will be sent back to me by June 1st so that's not an issue.

The police arrived at my house 45 minutes later, they had me send screenshots of each transaction and pictures of the girl ect,

 one of the transactions included a Greyhound ticket.

 While talking to the girl in person she mentioned she had moved here from Alabama two years ago so I assumed that's where the ticket was for and going to the Greyhound website based off the price of the ticket I was able to confirm that was more than likely true seeing as a next day Greyhound ticket cost the same amount that was charged to my card

 The police were notified of the departure times for today so hopefully she is apprehended at the Greyhound station,

I tried calling Greyhound multiple times and each time it said they were experiencing high call volumes and to leave a message so I left them multiple messages not that I thought it would help or anything but I figured it couldn't hurt.

 So my money is already being refunded and the police have been emailed all of the evidence needed, my only concern now is that this girl doesn't get away with what she's done and she is apprehended before getting on that bus and leaving the state, if she does manage to do that I already know the county she lives in out there so I will be contacting them as well, I would go up to the Greyhound station myself if it wasn't for the fact I have to work tomorrow, 

A lot of people were asking how she could have even accessed my account without the PIN number, the answer is simple usually when you use a debit card out of cash register even though it's a debit card you have the option to run it as credit for some reason. Which I personally never even do myself because supposedly there's more issues with transaction history and pending transactions when you do it that way, luckily for me when I reported it stolen 30 minutes after all of the transactions all of them were still pending which helped me out a lot

As far as the online Greyhound purchase went I'm pretty sure she would have at least needed my address.

 Every time I've ever used my debit card for an online purchase the only info I needed was the name of the card holder which is visible on the card, my address which I gave to her so she could show up at my house unfortunately, and the three digit security pin on the back of my card which would have also been visible to her.

This happened almost 24 hours ago, the police originally came over to take a statement and gave me an email address to send all of the evidence to, 

They then came back about an hour later with six folders containing six different mugshots of different individuals for a photo lineup and I was able to pick the person out who stole my card.

The police department opens in 3 hours and I will be contacting the investigating officer immediately to see if there's anything else I need to do before the departure times of the Greyhound tickets pass, 

I haven't contacted this individual yet to let them know I'm aware of what they've done in hopes they would let their guard down and not go off hiding, we met on tinder but moved the conversation to Facebook so we could video chat before meeting, big mistake of this is what she planned to do all along because she originally gave me a different last name and looking through her Facebook posts I was able to see she shared multiple posts from an account with the same first name as her but a different last name.

One of the transactions sent from my card was a Facebook payment to a single individual with the same last name as her so that person has been brought into the investigation as well, 

There were multiple payments at a speedway gas station and a Walmart, I'm guessing this girl doesn't work or hasn't for a while at least and is unaware of how far Bank apps have come these days because clicking on the Walmart transactions through my banking app actually tell me the exact date time and location of the Walmart the transactions or processed at so the police said they would be going up there and asking for security camera footage as well. I don't know about where you guys live but that Walmart's around here it's pretty much self checkouts that have front facing cameras just like ATMs do so she's pretty much screwed there..

If the police sound like they aren't going to be able to take care of the issue I plan on messaging this person and letting them know it's probably not in their best interest to get on that Greyhound bus because I will be up there waiting with the police in hopes that will scare them enough to trap them in the town I live.  

I think that about covers everything everyone was questioning and the previous post, hopefully the grammar is a little better for all the people complaining about that, 

For anybody asking for more private information I will definitely look into the rules of this sub and give out whatever information I'm able to, I feel like if she is arrested that would be public information and not be considered doxing if I shared it but I will have to look into it. I'm grateful for everybody who's been supportive thank you very much this was a pretty messed up day for me, definitely not how I wanted to spend my last day off of the week, I invited her to come out kayaking with me this morning so it's a little embarrassing having had this happen after thinking she was so polite and kind, 

I would definitely like to raise awareness for this type of thing happening to men, I always knew it was a possibility but I've been on countless dates just like this where we hang out at my place the first night after dinner or whatever, I've never really worried about someone stealing something right there while I'm present, my wallet wasn't laying out in the open or anything it was on my side of the bed at the base of the mattress and I didn't put it there for her to see so she legit must have searched around for it,

I woke up with an extremely bad migraine today as well so I am a little bit concerned she may have possibly put something in my drink because I didn't drink a lot last night at all and we had a big dinner and I've been drinking a lot of fluids lately since it's been warmer out the past two weeks, 

Hopefully that covers any questions anybody could possibly have, Police department opens up in two and a half hours I'll be calling them right away and I will update this post if anything happens, the Greyhound tickets are for either 3:00 p.m. today or 6:00 p.m. today, it's 6:35 a.m. at the time I'm typing this, if nothing happens by that point then unfortunately the police just didn't put enough effort in and she's probably in a different state, 

It would be really upsetting if that happened since I pretty much did all of the investigative work on finding out her real name, comparing the prices for the tickets to figure out that was the proper location of the purchase, pulling up the transactions to pinpoint the exact Walmart the money was spent at, 

I was really looking forward to the police contacting me later on yesterday telling me she had been apprehended I'm hoping they are sending somebody up to Greyhound, my only concern about that is the Greyhound station is in a different county that is 30 minutes away so I'm not sure how the different departments will cooperate with each other on that, if I have to before confronting the girl personally I will contact the different department and let them know what's going on with the situation. 

Sorry for this huge wall of text, but there was a lot of people saying their original post was hard to read and asking for more information, this is everything there is to know right here and I will update anything new happens thank you.",robbed,update june rd entirety money refunded today police information need put warrant stealing debit credit card felony warrant county card used put retail fraud warrant stealing merchandise failed attempt using card sure actually contact finally captured i m sure appear court update happened morning th th can t recall exactly whatever day post made today th i ve spoken detective last two days he s gone every location cards used viewed security footage business with they ve put felony warrants arrest yesterday officer county walmart located contacted asked could also share information theif last attempt use card locked walked store merchandise pay product also bringing separate charges that purchased greyhound ticket card chances even state anymore said charges would extraditable get picked brought back ever comes back probably got prison sentence waiting since already multiple felony theft charges probably end story finally happens update minutes update actual detective bureau investigation contacted said wednesday stopping every location transaction made reviewing footage every single transaction least one felony warrant said end taking greyhound state unfortunately warrant extraditable ever returns michigan children family catch eventually update spoke walmart today said detective tried contact missed call kind going back forth playing phone tag security manager gave direct line email officer help said footage transaction ready police come collect told individual time using stolen card also footage vehicle bank told need copy police report order credit money stolen guess simple going station requesting it email police department request sent police department pick pay around i m fine with lady kind rude said would contain whatever investigated far like waste time told really care need send bank get money back update i m guy who s debit card stolen tinder date yesterday invited girl dinner drinks movie woke gone fine with checked phone see time noticed multiple transactions recognize immediately canceled card reported stolen said funds sent back june st that s issue police arrived house minutes later send screenshots transaction pictures girl ect one transactions included greyhound ticket talking girl person mentioned moved alabama two years ago assumed that s ticket going greyhound website based price ticket able confirm likely true seeing next day greyhound ticket cost amount charged card police notified departure times today hopefully apprehended greyhound station tried calling greyhound multiple times time said experiencing high call volumes leave message left multiple messages thought would help anything figured hurt money already refunded police emailed evidence needed concern girl get away done apprehended getting bus leaving state manage already know county lives contacting well would go greyhound station fact work tomorrow lot people asking could even accessed account without pin number answer simple usually use debit card cash register even though debit card option run credit reason personally never even supposedly there s issues transaction history pending transactions way luckily reported stolen minutes transactions still pending helped lot far online greyhound purchase went i m pretty sure would least needed address every time i ve ever used debit card online purchase info needed name card holder visible card address gave could show house unfortunately three digit security pin back card would also visible her happened almost hours ago police originally came take statement gave email address send evidence to came back hour later six folders containing six different mugshots different individuals photo lineup able pick person stole card police department opens hours contacting investigating officer immediately see there s anything else need departure times greyhound tickets pass contacted individual yet let know i m aware they ve done hopes would let guard go hiding met tinder moved conversation facebook could video chat meeting big mistake planned along originally gave different last name looking facebook posts able see shared multiple posts account first name different last name one transactions sent card facebook payment single individual last name person brought investigation well multiple payments speedway gas station walmart i m guessing girl work least unaware far bank apps come days clicking walmart transactions banking app actually tell exact date time location walmart transactions processed police said would going asking security camera footage well know guys live walmart s around pretty much self checkouts front facing cameras like atms pretty much screwed there police sound like going able take care issue plan messaging person letting know probably best interest get greyhound bus waiting police hopes scare enough trap town live think covers everything everyone questioning previous post hopefully grammar little better people complaining that anybody asking private information definitely look rules sub give whatever information i m able to feel like arrested would public information considered doxing shared look it i m grateful everybody who s supportive thank much pretty messed day me definitely wanted spend last day week invited come kayaking morning little embarrassing happen thinking polite kind would definitely like raise awareness type thing happening men always knew possibility i ve countless dates like hang place first night dinner whatever i ve never really worried someone stealing something right i m present wallet laying open anything side bed base mattress put see legit must searched around it woke extremely bad migraine today well little bit concerned may possibly put something drink drink lot last night big dinner i ve drinking lot fluids lately since warmer past two weeks hopefully covers questions anybody could possibly have police department opens two half hours i ll calling right away update post anything happens greyhound tickets either p m today p m today a m time i m typing this nothing happens point unfortunately police put enough effort probably different state would really upsetting happened since pretty much investigative work finding real name comparing prices tickets figure proper location purchase pulling transactions pinpoint exact walmart money spent at really looking forward police contacting later yesterday telling apprehended i m hoping sending somebody greyhound concern greyhound station different county minutes away i m sure different departments cooperate that confronting girl personally contact different department let know what s going situation sorry huge wall text lot people saying original post hard read asking information everything know right update anything new happens thank you,robbed date morning
2,I got catfished today and it felt really bad,11283,1687,25/07/2022,"I prepared to meet with this girl who looked cute. We’ve had a nice conversation and arranged a meeting. When I saw her, I understood that she was using heavy filters to make her look skinnier - around 50 kgs less almost. 

I am totally fine dating curvy/chubby women and I dated in the past as well but I felt so disappointed and cheated that I just had some bullshit excuse and ended the meeting. 

Why would somebody do that ? Like what are you expecting during the meeting ? Anyway if any of you have any catfish stories, please share so that I will get over this lol",catfish,prepared meet girl looked cute weve nice conversation arranged meeting saw her understood using heavy filters make look skinnier around kgs less almost totally fine dating curvy chubby women dated past well felt disappointed cheated bullshit excuse ended meeting would somebody like expecting meeting anyway catfish stories please share get lol,got catfished today felt really bad
3,Tinder Secretly Removed A Major Benefit of Tinder Plus Subscription,4800,538,01/11/2021,"I've had Tinder Plus (the least-expensive of the 3 tiers of subscriptions) for about 6 months. Among the few things you get from the 'Plus Tier' is 5 daily super likes. All of a sudden I realize I'm not getting any super likes at all, I assume maybe my subscription ended for some reason and I go to resubscribe and lo-and-behold, I still have an active Tinder Plus subscription, still paying the same amount for the service. I look it up and see that tons of people over the past few months have noticed they're no longer getting daily super likes. I honestly cannot fathom how Tinder thinks it's okay to completely remove a key feature of a subscription service, not make the subscription cheaper, and not even tell their customers that they're no longer receiving all that they're paying for. Tinder is already such an unbelievably shady service, with shadow banning paying customers, hiding matches behind paywalls, and giving fake notifications to trick people into paying for Gold. This is the cherry on top. I guess I shouldn't be surprised, Tinder is a giant scam of an app and most people on it abuse it's poor mechanics. Just thought I'd share my frustration to see how many other people are sharing these feelings. Thanks for reading.",scam,i ve tinder plus the least expensive tiers subscriptions months among things get plus tier daily super likes sudden realize i m getting super likes all assume maybe subscription ended reason go resubscribe lo and behold still active tinder plus subscription still paying amount service look see tons people past months noticed they re longer getting daily super likes honestly cannot fathom tinder thinks okay completely remove key feature subscription service make subscription cheaper even tell customers they re longer receiving they re paying for tinder already unbelievably shady service shadow banning paying customers hiding matches behind paywalls giving fake notifications trick people paying gold cherry top guess surprised tinder giant scam app people abuse poor mechanics thought i d share frustration see many people sharing feelings thanks reading,tinder secretly removed major benefit tinder plus subscription
4,How it started vs how it’s going,4741,408,01/10/2022,"She had one photo, and literally 3 words on her profile, clearly a catfish … 3 years later, we are married 🥰",catfish,one photo literally words profile clearly catfish years later married,started vs going
5,Underagers,3202,225,15/07/2019,"I've been noticing an odd trend in my own tinder experience lately, I have had a handful of girls that turned out to not be their age on tinder in just the last week. Most recently, a girl I added on snapchat was taking senior pictures.. And rightfully so, I let her know how stupid it is to lie about your age. So, I figured I'd make a thread about being smart on dating apps, because some people are absolutely not. 

For the girls, you are not cute for being a minor hitting up dudes that are not minors. It's not cute to like older guys when you're 15, 16, 17. It's illegal. Especially if you are lying about your age. Depending on your state, sending dirty pictures is child pornography, dirty talk could be used against you in court as intent, and anything physical can absolutely be statutory rape. For the guy, all of the above will be implications to be labeled a sex offender for life, in the case of child pornography, that'll be both the girl and guy. 

Be smart, know your local laws, and for the love of God, if they are not 18, tell them to fuck off. A quick thrill is not worth a lifetime of labels. 

Be smart out there. Happy swiping!",sexual assault,i ve noticing odd trend tinder experience lately handful girls turned age tinder last week recently girl added snapchat taking senior pictures rightfully so let know stupid lie age so figured i d make thread smart dating apps people absolutely not girls cute minor hitting dudes minors cute like older guys illegal especially lying age depending state sending dirty pictures child pornography dirty talk could used court intent anything physical absolutely statutory rape guy implications labeled sex offender life case child pornography girl guy smart know local laws love god tell fuck off quick thrill worth lifetime labels smart there happy swiping,underagers
6,[ Removed by Reddit ],2152,94,17/04/2022,[ Removed by reddit on account of violating the [content policy](/help/contentpolicy). ],catfish,removed reddit account violating content policy help contentpolicy,removed reddit
7,Delete Tinder,1008,256,26/11/2021,"Stop letting them commoditize human loneliness. It doesn't work, it isn't healthy. 

Delete the apps, they deliberately make it hard for you to get matches because you'll get desperate enough to give them money. It's a scam, a racket.

Just delete all of them, I promise you that you will be so much happier.",scam,stop letting commoditize human loneliness work healthy delete apps deliberately make hard get matches get desperate enough give money scam racket delete them promise much happier,delete tinder
