index,Title,Score,Number_Of_Comments,Publish_Date,Content,Category,PreProcessedContent,PreProcessedTitle
59,Live Scam in Progress!,19,9,10/05/2021," I just signed up for Tinder Platinum about 3 weeks ago. The aim was to find a steady girlfriend. At first I was really enjoying all of the matches I was getting with some very attractive women. Most of them were also quick to move the conversation onto another messaging app. I live in Japan, so I mostly use LINE but have had a few women request my WhatsApp or WeChat. I also noticed that sometimes they would un-match me on Tinder once we moved to the other app.

After a while I started noticing that many of the women were into cryptocurrecy trading. They would talk about making $8,000 in one day and making $200,000 over the course of a few years. They would often send me screenshots of their trading screens showing how much money they made. Many of them said they were getting investment advice from their uncle. Yes, it seemed that everyone had some kind of ""uncle"" who had insider trading information.

At first I believed them.

""Wow,"" I thought. ""Everyone is talking so much about crypto! I didn't realize how popular it was!""

Not only that, these women were also rich and running successful businesses. A lot of them had their own clothing shops. Some of them were students or did real estate.

Wow! All of these rich beautiful women on Tinder are matching with me and wanting to pass on insider advice from their uncles. This is too good to be true!

However, I started to notice that although these women were happy to chat on LINE and seemed very interested in me, none of them would let me call them, and when I asked them on a date, they would say that they didn't know me well enough yet and that they were ""traditional Asian girls"" and didn't ""meet"" as soon as Americans did.

Fine, okay. But why were all of them so adamant about sharing their investment strategies with me? There had to be some kind of scam involved.

So I did some research about Tinder scams and learned a thing or two about some of the things that could happen. One scam that worried me was about SIM swapping, where the scammer could call up your phone company, pretend to be you, and get your phone number transferred from your SIM card to theirs. They could then easily access your e-mail, bank accounts, etc. because they now could receive your texts and bypass 2-step authentication.

""Omg,"" I thought. ""I gave my phone number to some of these women so that they could add me on WhatsApp! I hope they're not trying to scam me""

It seemed that a more common scam, however, was getting the victim to register on a phoney site or sign into the scammer's account and upload personal information. Another common one was the victim sending the scammer Bitcoin, thinking that they would get their coins back plus interest.

So, after reading this, it was like I couldn't trust anyone on Tinder anymore. Every new match I got I was suspicious of. Here's the story of one woman who was particularly obvious, and who I am now trying to catch red-handed scamming me. If you guys have any advice or insight, please share!

This woman's name on Tinder and on LINE was Lulu, but she introduced herself as Keiko Nagasawa. I reverse image searched all of her pictures, and they all checked out---i.e. they weren't stolen from the internet. She would talk to me nearly every day and seemed very interested, but, of course, she would occasionally drop crypto into the conversation every now and then. She said that she had her own clothing store in Shibuya, which is close to where I live, so I told her, ""Wow, we're so close! I go to Shibuya almost every day!"" I asked if she wanted to meet, and she said that she was shy, didn't know me well enough yet, and would be busy until next month. When I asked where her shop was---because I know the area well---she wouldn't tell me and would only say ""It's a small shop, and customers come in by appointment.""

Alright...

So I then asked if I could call her and have a chat, but she said that she couldn't talk, that she was too busy and she was worried about her poor English skills.

Alright...

But then one day, it was almost as if she had exploded. She texted me a longer-than-usual message saying that she was so happy to meet me and that she really trusted me and that she could see a wonderful future ahead for us. Even marriage! She was so happy, and she wanted to tell me of this great crypto investment opportunity that we could get in on together. She was learning how to invest from a ""teacher,"" and she and I could be very rich together and lead a happy life if we followed his advice.

Whoa, hold on there...

You already see a wonderful future with me and want to invest in crypto together, and we haven't even met in person? Some stranger on the internet? And you won't even talk to me on the phone?

She then doubled back, saying that she was sorry that it all came gushing out like that. She said that she was reluctant to meet me for a date because she had been assaulted in the past and even reading the word ""meet"" was traumatizing for her. But she said that I was different, and she could see herself opening up to someone like me in the future because she felt she could trust me.

Yeah, right. You don't trust me enough to meet me on a date, but you trust me enough to invest in crypto together...

So I stop talking to her for a day, and she messages me back tonight as if nothing happened. This time she asks if I can help her out with something. She's supposed to meet with her ""teacher"" tonight but is too busy, so asks me to log into her crypto account for her and add the teacher on LINE so he can tell me what to do.

At this point, I'm just going along with it to see how a scam actually plays out. I also think that by playing along I might be able to gather enough information to show the police and prevent scams like this from happening in the future. So I tell her that I'll help her and that I'll just do what she tells me to do. So she asks me to download an app called MetaTrade4 and log into her account. I tell her that I'm not so good with technology and for her to send me screenshots of how to do what she's telling me to do. So she sends me the screenshots, and I tell her that I'm in the process of downloading the app (I'm not, actually). I then ask what time she needs this done by, and she says by 8 or 9pm. I lie again and say that I'm a little busy tonight and have to stay in Shibuya for a while longer...but I could stop by her shop in Shibuya to do it together in person! She says she's got a meeting and is too busy to meet. I haven't messaged her back yet.

So, what should I do? I want to catch this girl! I want to call her a scamming little c\*\*\* and get her thrown in jail. Any advice greatly appreciated. I'm gonna see if I can extend our little dialogue until tomorrow, but I don't want to go too far and expose myself to danger! Please share your thoughts!",scam,signed tinder platinum weeks ago aim find steady girlfriend first really enjoying matches getting attractive women also quick move conversation onto another messaging app live japan mostly use line women request whatsapp wechat also noticed sometimes would un match tinder moved app started noticing many women cryptocurrecy trading would talk making one day making course years would often send screenshots trading screens showing much money made many said getting investment advice uncle yes seemed everyone kind uncle insider trading information first believed them wow thought everyone talking much crypto realize popular was that women also rich running successful businesses lot clothing shops students real estate wow rich beautiful women tinder matching wanting pass insider advice uncles good true however started notice although women happy chat line seemed interested me none would let call them asked date would say know well enough yet traditional asian girls meet soon americans did fine okay adamant sharing investment strategies me kind scam involved research tinder scams learned thing two things could happen one scam worried sim swapping scammer could call phone company pretend you get phone number transferred sim card theirs could easily access e mail bank accounts etc could receive texts bypass step authentication omg thought i gave phone number women could add whatsapp hope they re trying scam me seemed common scam however getting victim register phoney site sign scammer s account upload personal information another common one victim sending scammer bitcoin thinking would get coins back plus interest so reading this like trust anyone tinder anymore every new match got suspicious of here s story one woman particularly obvious trying catch red handed scamming me guys advice insight please share woman s name tinder line lulu introduced keiko nagasawa reverse image searched pictures checked out i e stolen internet would talk nearly every day seemed interested but course would occasionally drop crypto conversation every then said clothing store shibuya close live told her wow we re close go shibuya almost every day asked wanted meet said shy know well enough yet would busy next month asked shop was because know area well she tell would say it s small shop customers come appointment alright asked could call chat said talk busy worried poor english skills alright one day almost exploded texted longer than usual message saying happy meet really trusted could see wonderful future ahead us even marriage happy wanted tell great crypto investment opportunity could get together learning invest teacher could rich together lead happy life followed advice whoa hold there already see wonderful future want invest crypto together even met person stranger internet even talk phone doubled back saying sorry came gushing like that said reluctant meet date assaulted past even reading word meet traumatizing her said different could see opening someone like future felt could trust me yeah right trust enough meet date trust enough invest crypto together stop talking day messages back tonight nothing happened time asks help something supposed meet teacher tonight busy asks log crypto account add teacher line tell do point i m going along see scam actually plays out also think playing along might able gather enough information show police prevent scams like happening future tell i ll help i ll tells do asks download app called metatrade log account tell i m good technology send screenshots telling do sends screenshots tell i m process downloading app i m not actually ask time needs done by says pm lie say i m little busy tonight stay shibuya longer but could stop shop shibuya together person says got meeting busy meet messaged back yet so do want catch girl want call scamming little c get thrown jail advice greatly appreciated i m gonna see extend little dialogue tomorrow want go far expose danger please share thoughts,live scam progress
60,Serious question: what do you do when catfished?,19,79,31/10/2022,"So I was catfished/fat fished for a third time. She showed up and she was about 30 to 50 lb more than her pics. She must have used pre pandemic pics. I video chatted with her. She used great angles to optimize everything. She didn’t have much face fat but she was carrying it all in her gut, arms, legs, etc, which I just couldn’t see. 

When we first met, she insulted the way I dressed. And then wanted me to pay for all the food. 2 minutes into meeting her, I was honest, told her that I wasn’t interested and just left before I even ordered anything. 

How’s the best way to handle this when you get catfished despite video chatting and verifying with photos? Just say I’m not interested and just bolt like i did? Call her out for the catfish? I’m concerned she will make a scene. Just say that I need to grab my wallet from my car and never return? What’s the best way to get out without wasting time and money with someone who’s intentions are to lie all while trying to spare her feelings and not have it blow up in my face?",catfish,catfished fat fished third time showed lb pics must used pre pandemic pics video chatted her used great angles optimize everything didnt much face fat carrying gut arms legs etc couldnt see first met insulted way dressed wanted pay food minutes meeting her honest told wasnt interested left even ordered anything hows best way handle get catfished despite video chatting verifying photos say i am interested bolt like did call catfish i am concerned make scene say need grab wallet car never return whats best way get without wasting time money someone whos intentions lie trying spare feelings blow face,serious question catfished
61,"Hinge match tried to catfish me for bus fare, decided to waste their time.",19,14,14/03/2020,"Matched with a girl on hinge and set up a date, day of the date she asks for bus fare from Brooklyn to Manhattan. decided to have some fun and mess with whoever was on the other side and waste their time.

https://preview.redd.it/kytoumihgjm41.jpg?width=1125&format=pjpg&auto=webp&s=28f6f894ab09288c27ef264f6632b1e5ef4c130d",catfish,matched girl hinge set date day date asks bus fare brooklyn manhattan decided fun mess whoever side waste time https preview redd it kytoumihgjm jpg width format pjpg auto webp s f f ab c ef f be e ef c d,hinge match tried catfish bus fare decided waste time
62,"ValenTinder – Red, White and Blue (balls)",19,2,12/02/2015,"The great Whitney Houston once said “Some people wait a lifetime for a moment like this”. It’s the Super Bowl of one night stands, the World Series of opening lines and the Boxing Day of emotions, and morals and clothes are half off. **It’s Valentine’s Day**. You have been using your [Tech Decks](http://i.imgur.com/mPKwv7o.png) for weeks preparing your fingers for the physical assault. The McDonald’s of sex is open and you want a Big Mac. It’s your moment and not even Kanye West can interrupt it. 

**The Metrics**

The first step after downloading tinder is to set your preferences. Age and gender preferences are entirely up to you. I just warn when you play in the 18 age range you will find a lot of “sorry actually 16, Facebook won’t let me change it”. Attention to details are important so you don’t spend Valentine’s Day with [Chris Hansen](http://i.imgur.com/RTHOh87.png). My only recommendation is to set a reasonable search radius of about 20 miles. You’re trying to find someone to hang out with, not a location to take a SpaceX trip to.

**The Photos**

Think of this of your highlight reel of life. This is your chance to show off that you did cool shit like skydive without boring your friends with the same story over and over. Through years of research, and just a touch of luck, I have discovered the perfect combination of photos needed to make girls swipe right faster than Michael J. Fox. 

**Profile Photo** – This is the photo that pops up during the opening process and is the most important. They say don’t judge a book by its cover but this is Tinder and you’re not a fucking book. Here I advise you use your most adventurous/mysterious photo. Can only see half your face in it? Perfect, entice them to keep scrolling.

**Second Photo** - The animal photo. Every girl has cried while eating a gallon of Haagen Daz to [Marley & Me](http://i.imgur.com/Lp2QZCC.png) or has a favourite stuffed animal. Don’t have a pet? Use your friends. Don’t have friends? Go adopt one for the photo and then release it into the wild. They didn’t sign a waiver for this feels trip but they’re on it and you’re driving.

**Remaining Photos** – This is where you highlight your best assets. If you’re muscular, use a photo of you (pretending not to flex) at the beach. If you play guitar, show a photo of you performing. Simple? Yes. The group photos seem to carry a stigma but using it later in your photos is a plus. It shows you actually have friends and you’re not planning on murdering her in a dark alley.

**The Bio**

You switched your opening photo from your mirror selfie and you’re actually getting the look over. The next stage of the process is the bio. The point of the bio isn’t to actually get to know someone, it’s for opening liners. No one cares that you: like football, you’re new to this app and you ~*~*~live for the nights you can’t remember with the people you will never forget ~*~*. Put something humorous to initiate the conversation like “Born to be the big spoon” or more specifically “Looking for an Anastasia Steele to my Christian Grey”. 

**Tinder Moments**

Don’t.

**The Opener**

Congratulations! You have a new match! And it’s not a bot. The first rule is, hey is for horses and people who get ignored. Don’t send a generic reply and pull a [Marcus Aurelius](http://i.imgur.com/D4zU9Iw.png) staring at a blank screen. Use humour, use their bio or use their name in a pun. Remember you are both clearly sexually attracted to each other so see if you are now emotionally. /r/tinder is your friend.
	
I’ve done all I can now, the phone is in your hands. Happy Hunting.
",assault,great whitney houston said people wait lifetime moment like this super bowl one night stands world series opening lines boxing day emotions morals clothes half off its valentines day using tech decks http i imgur com mpkwv o png weeks preparing fingers physical assault mcdonalds sex open want big mac moment even kanye west interrupt it the metrics first step downloading tinder set preferences age gender preferences entirely you warn play age range find lot sorry actually facebook wont let change it attention details important dont spend valentines day chris hansen http i imgur com rthoh png recommendation set reasonable search radius miles youre trying find someone hang with location take spacex trip to the photos think highlight reel life chance show cool shit like skydive without boring friends story over years research touch luck discovered perfect combination photos needed make girls swipe right faster michael j fox profile photo photo pops opening process important say dont judge book cover tinder youre fucking book advise use adventurous mysterious photo see half face it perfect entice keep scrolling second photo animal photo every girl cried eating gallon haagen daz marley me http i imgur com lp qzcc png favourite stuffed animal dont pet use friends dont friends go adopt one photo release wild didnt sign waiver feels trip theyre youre driving remaining photos highlight best assets youre muscular use photo pretending flex beach play guitar show photo performing simple yes group photos seem carry stigma using later photos plus shows actually friends youre planning murdering dark alley the bio switched opening photo mirror selfie youre actually getting look over next stage process bio point bio isnt actually get know someone opening liners one cares you like football youre new app live nights cant remember people never forget put something humorous initiate conversation like born big spoon specifically looking anastasia steele christian grey tinder moments dont the opener congratulations new match bot first rule is hey horses people get ignored dont send generic reply pull marcus aurelius http i imgur com d zu iw png staring blank screen use humour use bio use name pun remember clearly sexually attracted see emotionally r tinder friend ive done now phone hands happy hunting,valentinder red white blue balls
63,Need advice on how to date while having body dysmorphia,18,8,11/09/2019,I got tinder and it’s unreal to me that I’ve actually been getting matched with attractive people. The only issue is I strongly believe I’m a catfish which is why I haven’t met with anyone. My friend assures me that the pictures I’ve uploaded look like me but I don’t believe her. It’s not like I think my pictures are incredibly good but because I’m getting matched with good looking guys I don’t think it looks like me. In real life guys like that don’t look my way. It’s tough because I feel like I’m ready to date as I just got out of a relationship a couple months ago. I’m just so afraid of being rejected or being a disappointment because I don’t look like my pictures. I even made sure all my pictures aren’t filtered and I included some body pics. I tried to keep it as real as possible but I still believe i look fatter and uglier in person. Anyways I’m kinda looking for tips on how to build up the courage and just go on a date.,catfish,got tinder unreal ive actually getting matched attractive people issue strongly believe i am catfish havent met anyone friend assures pictures ive uploaded look like dont believe her like think pictures incredibly good i am getting matched good looking guys dont think looks like me real life guys like dont look way tough feel like i am ready date got relationship couple months ago i am afraid rejected disappointment dont look like pictures even made sure pictures arent filtered included body pics tried keep real possible still believe look fatter uglier person anyways i am kin the looking tips build courage go date,need advice date body dysmorphia
64,"Tindweb.com = scam, right?",18,40,27/07/2015,"Chatting with someone,  she says she needs to ""get off my cell phone"" (what?) and sends me a link to Tindweb.com. 

I assume it's scammy bullshit. Should I report her? Is it actually legit? ",scam,chatting someone says needs get cell phone what sends link tindweb com assume scammy bullshit report her actually legit,tindweb com scam right
65,"Guys, what the fat girls do?",18,35,21/01/2020,"Serious question. Recently single, going to attempt online dating. I'm not skinny, pretty upfront and honest about it (pics in my profile to see). Here's the thing, I don't feel bad, I like myself. I'm pretty effing dope.... Buuuut....

I want to make it clear I'm not skinny, but also not dwell on it. I'm not trying to catfish anyone here. Do you just post recent full body pics and leave it at that? I'm worried some idiot won't swipe through my pics and be a dick when we meet.

Thoughts? Advice?",catfish,serious question recently single going attempt online dating i m skinny pretty upfront honest pics profile see here s thing feel bad like myself i m pretty effing dope buuuut want make clear i m skinny also dwell it i m trying catfish anyone here post recent full body pics leave that i m worried idiot swipe pics dick meet thoughts advice,guys fat girls do
66,Girl wants to meet but wont give me her number.,17,17,25/05/2017,"We started chatting a couple of days ago. A bit flirtatious, then all of a sudden she wants to meet up and my place and hook up. But, she won't give me her number. She added me on snapchat and we've sent a few photos back and forth so I'm fairly confident that it's not a catfish. However the paranoid parrot inside of me is concerned that she's like setting me up to get robbed or something. Idk, I find it odd that she's willing to come over to hook up but won't give me her phone number. 

Any advice reddit? ",catfish,started chatting couple days ago bit flirtatious sudden wants meet place hook up but give number added snapchat we ve sent photos back forth i m fairly confident catfish however paranoid parrot inside concerned like setting get robbed something idk find odd willing come hook give phone number advice reddit,girl wants meet wont give number
