index,Title,Score,Number_Of_Comments,Publish_Date,Content,Category,PreProcessedContent,PreProcessedTitle
429,Gave my phone number to someone I probably shouldn't have. Am I just being paranoid or did I do something very bad?,2,2,09/01/2015,"Got matched with a really attractive girl who apparently lives somewhat nearby. At first I thought she was a bot, mostly due to the fact that she seemed totally out of my league, but we chatted a bit and I'm fairly certain that I was talking to a real person. What I'm not certain of is whether or not the person I was chatting with was an actual 18 year old asian girl with a super model body.

After making small talk for a couple of days, she messages me and says ""U want me to text u so I get your number? I'm on my tablet (phone's broken) but what's your #?"". 

I'm a bit confused by this and I ask her how we could possibly text if her cell phone's broken. She responds saying that her phone's broken but she can text via an app on her tablet. 

At this point I'm a little bit hesitant, but I send some screen caps to a friend and he insists I go for it. Carpe Diem and whatever. I send her my phone number, and I receive a strange text that says ""Spotlight Verification Code"" with a multi-digit number that I won't be telling you. Shortly after that, I receive another message on tinder from her asking me to tell her that number, because she needs it to be able to text me. I sigh, contemplate it a bit, and then send her the code. To play it safe, I ask her on tinder if she's a hacker (adding a ""hahaha"" to soften the accusation). She responds with a ""no lol"", so I'm obviously safe. Obviously, right? 

I get a text message from her a few minutes later with her name, and I respond with my name and and a smiley face because I'm a flirty motherfucker. I don't hear back from her. Couple hours later, still no response. I go back to Tinder, and she's gone. Not sure if she deleted her profile or if she only unmatched me, but there's no trace of her. 

I tell this to a few other friends and they think she's some kind of scammer. I look up the phone number she texted me with and the appears to be somewhat nearby. However, the initial number that sent me the verification code is from the states (I'm in Canada). 

I text her a simple ""hey, what's up?"" about six hours after the number exchange, and now, 4 hours after that, I am still waiting for a response. 

SO 

has anyone hear ever faced something similar? Do you think this girl is legitimate and I'm just a paranoid loser or did I walk right into some kind of scam?  If I am being played, where do I go from here? 

I think I'm done talking to cute girls. ",scam,got matched really attractive girl apparently lives somewhat nearby first thought bot mostly due fact seemed totally league chatted bit i m fairly certain talking real person i m certain whether person chatting actual year old asian girl super model body making small talk couple days messages says you want text you get number i m tablet phone s broken what s i m bit confused ask could possibly text cell phone s broken responds saying phone s broken text via app tablet point i m little bit hesitant send screen caps friend insists go it carpe diem whatever send phone number receive strange text says spotlight verification code multi digit number telling you shortly that receive another message tinder asking tell number needs able text me sigh contemplate bit send code play safe ask tinder hacker adding hahaha soften accusation responds no lol i m obviously safe obviously right get text message minutes later name respond name smiley face i m flirty motherfucker hear back her couple hours later still response go back tinder gone sure deleted profile unmatched me there s trace her tell friends think kind scammer look phone number texted appears somewhat nearby however initial number sent verification code states i m cana the text simple hey what s up six hours number exchange now hours that still waiting response anyone hear ever faced something similar think girl legitimate i m paranoid loser walk right kind scam played go here think i m done talking cute girls,gave phone number someone probably have paranoid something bad
430,Is Tinder Gold worth it?,2,13,09/05/2022,"I've been getting around 2-3 matches a month and for the rest of the month just 0 likes. To be fair, I only swipe when I see that someone has liked me but other than that, I don't. I'm curious as to whether Tinder Gold does actually ""boost"" your profile? makes your likes get seen sooner? Those who tried it, does it actually help or is it a scam? 

Ps, no one suggest the Tinder Platinum crap, no way am I spending that amount of money on a rigged dating app",scam,i ve getting around matches month rest month likes fair swipe see someone liked that don t i m curious whether tinder gold actually boost profile makes likes get seen sooner tried it actually help scam ps one suggest tinder platinum crap way spending amount money rigged dating app,tinder gold worth it
431,A girl clearly out of my tinder-league just messaged me. Is she a prostitute?,2,7,08/08/2014,"Honestly. This girl is smoking. She has a couple of pictures, all of them looks authentic. She started the conversation by calling me handsome. Is she trying to scam me or something? Has this ever happened to you? Not even the ugly girls I have matched with (yes, I am a right-sweeper, it's a habit which springs from my initial zero matches) will type me anything first. This is the first one I even talk to. 

I'm an anti-social Swede, so I'm contemplating just deleting the app now since I might have to do some talking. ",scam,honestly girl smoking couple pictures looks authentic started conversation calling handsome trying scam something ever happened you even ugly girls matched yes right sweeper habit springs initial zero matches type anything first first one even talk to i m anti social swede i m contemplating deleting app since might talking,girl clearly tinder league messaged me prostitute
432,We're Real... and we're FANTASTIC,2,0,13/02/2015,"We are hosting a tinder social meet up in Brooklyn.  There will be balloons and some awesome single people.  If you match up with us, it's not a scam - we don't work for the bar, or tinder or anything.  We just wanted something awesome to do for Valentine's day instead of eat ice cream, watch the notebook and cry.

[Facebook Event Page - Valentine's Bash!](https://www.facebook.com/events/761863673905020/?ref_dashboard_filter=upcoming)
",scam,hosting tinder social meet brooklyn balloons awesome single people match us scam work bar tinder anything wanted something awesome valentine s day instead eat ice cream watch notebook cry facebook event page valentine s bash https www facebook com events ref dashboard filter upcoming,we re real we re fantastic
433,50% tinder gold discount actually scam?,2,2,16/04/2020,"So I've received an 50% discount offer for the tinder gold, but after I continue into checkout the actual price they want me to pay is 19.83BGN...(it says its going to be 10.99) Pretty dumb or is there something wrong LOL!?

https://preview.redd.it/l4oh6m7q49t41.png?width=405&format=png&auto=webp&s=83f8b2c8156b5bb2dce00812b717712ad3934d70",scam,i ve received discount offer tinder gold continue checkout actual price want pay bgn it says going pretty dumb something wrong lol https preview redd it l oh m q t png width format png auto webp s f be c be bb dce be ad d,tinder gold discount actually scam
434,"Started talking to a girl today, within 2 hours of talking she's ready to come over to my place for the night, is this normal?",2,12,14/09/2019,"I'm pretty trusting of people but idk, aren't woman like worried about rape and stuff like that when going over to someone's house they've never met before? Just seems very brazen considering all of the nightmare stories I've heard from woman. It seems really strange to me that after talking for less than half a day she's already ready to come over to my place? Am I just overthinking it?",sexual assault,i m pretty trusting people idk woman like worried rape stuff like going someone s house they ve never met before seems brazen considering nightmare stories i ve heard woman seems really strange talking less half day already ready come place overthinking it,started talking girl today within hours talking ready come place night normal
435,Is matching just not working?,2,8,25/06/2021,"So i decide to reopen tinder adfter a week of leaving it. Immediately found one of the 3 people who'd liked me, liked them went to send my message, tinder said the message failed to send and now she has been removed from this astral plane apparently.

I then get this weird ""whats behind door number 1-4?"" and choose the right one, match with her and I can see her profile is not in my messages, it's in my people who liked you section.

The second girl shows up again, this time normally, I like her and SHE IS STILL IN MY PEOPLE WHO LIKED YOU SECTION?

Is this a glitch? Tinders new scam?

What is happening?",scam,decide reopen tinder adfter week leaving it immediately found one people who d liked me liked went send message tinder said message failed send removed astral plane apparently get weird whats behind door number choose right one match see profile messages people liked section second girl shows again time normally like still people liked section glitch tinders new scam happening,matching working
436,What happens when you report an account,2,5,23/05/2019,"I don’t know if this is the right place to ask this so if I’m in the wrong place please help redirect me!

But I saw a dude from an organization on campus I’m involved in on tinder. The guy is a known predator. He was kicked out of the organization for his behavior towards women. He was accused for sexual assault & was Title IX’ed recently. He was found responsible & was kicked out of college about a month ago. 

I reported his account because it’s a huge campus so most girls seeing his profile won’t know he was kicked out of college for attempted rape. I don’t think it’s safe for him to have a profile & increase his access to women. I reported his profile detailing why I was doing so. Does tinder send a follow up about an account you report? I want to know if they take it seriously & if he’s removed or not",sexual assault,dont know right place ask i am wrong place please help redirect me saw dude organization campus i am involved tinder guy known predator kicked organization behavior towards women accused sexual assault title ixed recently found responsible kicked college month ago reported account huge campus girls seeing profile wont know kicked college attempted rape dont think safe profile increase access women reported profile detailing so tinder send follow account report want know take seriously hes removed,happens report account
437,Tinder Gold is a scam.,2,4,23/09/2019,"Had Tinder Gold for almost 5 months now

Had more matches the first week before I got Tinder Gold, and don't give me this BS about swiping right too much.

I swipe left almost as much as a girl. Only time I get matches now if I use boost.",scam,tinder gold almost months matches first week got tinder gold give bs swiping right much swipe left almost much girl time get matches use boost,tinder gold scam
438,Unban Scam?,2,5,13/04/2022,"There's an Instagram user who claims he can unblock Tinder profiles with ""green python firmware."" Whatever that's supposed to be. They claim there's some database they can get me removed from that will unban my profile. They charge $75 for the service. This all smells like a scam. I'm half tempted to try it just for the fun of it, but I don't want any worse consequences than being out the money. How dangerous is trying it? They claim they need my phone number and name.",scam,there s instagram user claims unblock tinder profiles green python firmware whatever that s supposed be claim there s database get removed unban profile charge service smells like scam i m half tempted try fun it want worse consequences money dangerous trying it claim need phone number name,unban scam
439,What are these safe date codes?,2,9,03/01/2017,"I've been asked multiple times for a safe date code now, and still don't know what these are. Are they some kind of scam? datesafecodes and tindersystem are the sites I'm being sent to.",scam,i ve asked multiple times safe date code now still know are kind scam datesafecodes tindersystem sites i m sent to,safe date codes
440,Probably a scam,2,6,14/02/2017,"I had a 22 y.o female super like me from 162 miles away. Her name was Marissa. She told me she came up to my state sometimes for family and friends. Third message says shes looking for a friends with benefits gig. Pretty hot. Me being horny says OK WOW YEA. I asked her okay what's the catch? This is too good to be true. She says 'uhhh, I want sex?' then she starts flirting and teasing asking about my sexual preferences and getting herself hot from my responses.

This whole time her bio has nothing. No IG doesn't give a phone number, won't send pics says 'lets wait until we meet'. She just wants to meet and bang. Anywhere. I moved out of my apartment recently back with my rents and I tell her this. She's like yeah motel or car sounds good to me. It's all too good to be true. Im eventually like yo listen. I'm sketched out. I've been in the game before I've seen some shit my Spidey senses are tingling. She insta unmatched me afterwards. I'm almost positive I was gonna get robbed. Thoughts?",robbed,y o female super like miles away name marissa told came state sometimes family friends third message says shes looking friends benefits gig pretty hot horny says ok wow yea asked okay what s catch good true says uhhh want sex starts flirting teasing asking sexual preferences getting hot responses whole time bio nothing ig give phone number send pics says lets wait meet wants meet bang anywhere moved apartment recently back rents tell this like yeah motel car sounds good me good true i am eventually like yo listen i m sketched out i ve game i ve seen shit spidey senses tingling insta unmatched afterwards i m almost positive gonna get robbed thoughts,probably scam
441,Scam site? liveverify.net,2,5,12/09/2015,"Match with girl, she immediately gives me her number and says she's dtf. Gives me a link to liveverify.net/ and says i can get her address through that. Says it's free and legit but it asks for my card #and after 9 days will charge $40. my scam alert is going off and she's being persistent i use that saying she's been burned before. according to [this](http://www.scamadviser.com/check-website/liveverify.net) I think my paranoia is justified",scam,match girl immediately gives number says dtf gives link liveverify net says get address that says free legit asks card and days charge scam alert going persistent use saying burned before according this http www scamadviser com check website liveverify net think paranoia justified,scam site liveverify net
442,Getting less matches with tinder plus than with tinder free?,2,5,03/07/2019,"Hey everyone. I recently created my account and while I was using free tinder I got over 10 matches the first day and then 2 matches a day for the rest of the week. Now that I've paid for tinder plus, all the YouTube videos I watched say they saw 3 times the number of matches than with free tinder, yet this morning during the peak morning time I got nothing while usually I would get a couple every day at that time using free tinder. Everyone said that using free tinder won't get you anything, but it seems like the opposite is true. Do any of you know why I would get less after paying? Do you think its a scam? Is my ELO score too low? What might be the problem?",scam,hey everyone recently created account using free tinder got matches first day matches day rest week i ve paid tinder plus youtube videos watched say saw times number matches free tinder yet morning peak morning time got nothing usually would get couple every day time using free tinder everyone said using free tinder get anything seems like opposite true know would get less paying think scam elo score low might problem,getting less matches tinder plus tinder free
443,What happens when you report an account,2,5,23/05/2019,"I don’t know if this is the right place to ask this so if I’m in the wrong place please help redirect me!

But I saw a dude from an organization on campus I’m involved in on tinder. The guy is a known predator. He was kicked out of the organization for his behavior towards women. He was accused for sexual assault & was Title IX’ed recently. He was found responsible & was kicked out of college about a month ago. 

I reported his account because it’s a huge campus so most girls seeing his profile won’t know he was kicked out of college for attempted rape. I don’t think it’s safe for him to have a profile & increase his access to women. I reported his profile detailing why I was doing so. Does tinder send a follow up about an account you report? I want to know if they take it seriously & if he’s removed or not",assault,dont know right place ask i am wrong place please help redirect me saw dude organization campus i am involved tinder guy known predator kicked organization behavior towards women accused sexual assault title ixed recently found responsible kicked college month ago reported account huge campus girls seeing profile wont know kicked college attempted rape dont think safe profile increase access women reported profile detailing so tinder send follow account report want know take seriously hes removed,happens report account
444,"Verified woman in another country asks for my WA, what's going on?",2,9,27/10/2022,"I mean basically I'm in Indonesia she's in Malaysia, so like why? There are loads of guys in Malaysia. I haven't given her my WA, but I'm suspicious. Is this some kinda scam or what is the goal here?

She's also like 11 years younger than me.",scam,mean basically i m indonesia malaysia like why loads guys malaysia given wa i m suspicious kin the scam goal here also like years younger me,verified woman another country asks wa what s going on
445,Damn.. got cat fished so hard,2,6,08/06/2018,"So I match with a good amount of girls but this one EXTREMELY GORGEOUS female that i matched with defiantly stood out. Not only was her pictures nice her bio was interesting. We talked for a few days and I actually enjoyed talking to her since she seemed different. Was surprising honestly.. We trash talked each other over the NBA finals (she's taking the GSW) I was taking the (Cavs) I ended up saying that if cavs win she takes me out for coffee (her bio said she was looking for someone decent to have coffee with) and if GSW wins I take her out. Anyways during the series we talked and trash talked about the game. She was down for this date btw and I hit her with a steph curry hitting his shot giphey too.

Randomly today she unmatched me and I was really surprised I couldn't believe it I was kinda embarassed because I felt like wow was I actually starting to really like this girl? Thankfully I had a picture saved of her since I showed my friend her profile and I randomly tried googling her image and there you have it she showed up on Insta under a different name. Man that's depressing.. why do people catfish? It's a really shitty feeling.",catfish,match good amount girls one extremely gorgeous female matched defiantly stood out pictures nice bio interesting talked days actually enjoyed talking since seemed different surprising honestly trash talked nba finals she s taking gsw taking cavs ended saying cavs win takes coffee her bio said looking someone decent coffee with gsw wins take out anyways series talked trash talked game date btw hit steph curry hitting shot giphey too randomly today unmatched really surprised believe kin the embarassed felt like wow actually starting really like girl thankfully picture saved since showed friend profile randomly tried googling image showed insta different name man that s depressing people catfish really shitty feeling,damn got cat fished hard
446,Tinder gold scam?,2,1,08/05/2020,"Hey, like many users here I don't wanna pay for tinder gold or plus but I'd wanna take whatever chance I can to get more matches, so I saw all these ""how to get free tinder gold/plus"" videos on YouTube, and there are a lot of them, and I followed the instructions, basically it's to go to a website, seemed pretty smooth, click a few things enter your username and then ""verify"" you're human by downloading an app running it for 30 seconds and then tinder gold will be automatically uploaded to your phone. Seemed easy enough and looked genuine in the videos but it totally didn't work for me so I looked in the comments for the problem or the solution and it seemed that it worked for everyone, I mean EVERYONE, and it started to look kinda fishy to me, I looked at these YouTube channels that seemed genuine and I see that it's like pretty much the only video in the channel or the first video after 6 years, and it started to look very fishy, but I saw no information on this scam. Do anyone know anything? Is it genuine after all and just didn't work for me? Is it a scam and did I harm my phone or helped someone steal my information or anything? These videos have tens of thousands of views so it's weird that I can't find any information about it.",scam,hey like many users wanna pay tinder gold plus i d wanna take whatever chance get matches saw how get free tinder gold plus videos youtube lot them followed instructions basically go website seemed pretty smooth click things enter username verify human downloading app running seconds tinder gold automatically uploaded phone seemed easy enough looked genuine videos totally work looked comments problem solution seemed worked everyone mean everyone started look kin the fishy me looked youtube channels seemed genuine see like pretty much video channel first video years started look fishy saw information scam anyone know anything genuine work me scam harm phone helped someone steal information anything videos tens thousands views weird can t find information it,tinder gold scam
447,Idk of Tinder Devs troll around here but i have a feature I’d love to see get added,2,0,15/04/2020,"Be able to block people from your feed just based on bio. Most of the spam accounts I come across trying to get me to join their onlyfans/ scam me all have the same bio. There’s literally like 3 different bios that I just insta report because I know that it’s spam. If I could just have a list of blocked bios and anyone with that boi just doesn’t show up, it would at least make all of the scammers work a little harder than just copy and past with stolen photos.",scam,able block people feed based bio spam accounts come across trying get join onlyfans scam bio theres literally like different bios insta report know spam could list blocked bios anyone boi doesnt show up would least make scammers work little harder copy past stolen photos,idk tinder devs troll around feature id love see get added
448,Is there a subreddit where people can get help identifying scams on dating apps?,2,2,02/11/2022,"Apologies as this isn’t the typical content here. I think we all deal with scam profiles a lot in the dating app game, so was trying to see if there’s a subreddit for people to check on potential scam situations and get input?

I know there’s some simple ones (e.g., moving to WhatsApp, lots of suspiciously professional photos)… but I guess I’m envisioning a “have your seen this profile/photo” forum to get input. I recently posted such a thing on r/tipofmypenis but not sure that’s really the right place either haha.",scam,apologies isnt typical content here think deal scam profiles lot dating app game trying see theres subreddit people check potential scam situations get input know theres simple ones eg moving whatsapp lots suspiciously professional photos guess i am envisioning seen profile photo forum get input recently posted thing r tipofmypenis sure thats really right place either haha,subreddit people get help identifying scams dating apps
449,Can anyone please explain this to me?,2,3,18/01/2022,I’ve been on and off tinder and I recently noticed a profile sitting under my matches and I’m pretty sure I never swiped right to that profile as it seemed not from my region. Also I noticed something strange. This profile disappears and appears in my matches. From the look of it seems like a scam profile but I didn’t expect tinder to be so vulnerable.,scam,ive tinder recently noticed profile sitting matches i am pretty sure never swiped right profile seemed region also noticed something strange profile disappears appears matches look seems like scam profile didnt expect tinder vulnerable,anyone please explain me
