index,Title,Score,Number_Of_Comments,Publish_Date,Content,Category,PreProcessedContent,PreProcessedTitle
234,I think a lot of you guys got it all wrong (my theory on tinder use),5,7,08/11/2017,"This post isn't about trying to get laid. Honestly, don't act just like you are trying to get laid. That doesn't mean don't be sexual. But women have to deal with constantly getting sexualized on tinder so save the ""let me sit on your face openers"" (i mean seriously wtf is even the point of doing that) 

Now, I don't know how tinder stats generally play out, but for reference I have over 2000 matches and have only ever used tinder as a way to meet people. I got it in the summer going into 10th grade (back when minors could use it) and am now almost 19 and a freshman in uni. 


I'm not a super good looking guy, but not too bad either. My main downside is that I am very skinny (5'11"" and ~110 lbs.) I have used tinder for a number of hookups, and had multiple relationships from it, including my current one which I am very happy about. I am no expert in tinder, but I see a lot of people who are over hyping every interaction and I don't see that as producing a positive outcome. 


I can only really comment on tinder usage in my age group, so young people. 


It seems like the main problem people have here is that they overthink how they should communicate with their matches and that limits them from finding what they really want. Tinder isn't some digital bar where the guys compete to see who has the suavest pickup line. Tinder is about exploring and experimenting with the human psyche. Try things out, experiment. Ask interesting and entreating questions about the human experience. Be open and humble. Don't force interaction with a match because you feel the need to. You have the opportunity to meet many more people than you otherwise would. At least for me, I literally have never once in my life gone and hit on a girl in public, or at a party or anything. Tinder isn't a way for me to simulate that, it's a way to circumvent it. 



*if you just act like a thoughtful, caring, interesting person people will like you*

On tinder you cast a wide net. If you live in a densely populated area it should't be hard to get matches. Don't catfish someone, but also choose good pictures of yourself. It's about getting the foot in the door for the largest amount of people. 



I personally have generally right swiped on everyone then unmatched people I wasn't interested in. But that's just because I'm lazy and don't really see a purpose in focusing too heavily on initial selections. I have read that the algorithm may lower the tinder elo if your profile if you do this so do whatever works best with you in terms of swiping. 

Heres the only piece of advice I could really give: be yourself.

I know that sounds cliche, and at least with me I am a very intellectual person (not saying I'm intelligent, I just like talking about random shit over small talk) Whether or not a girl can talk to me about something completely different than what is expected is the majority of how I choose to meet someone. I have also found that nearly every girl I have ever gotten to know from tinder has told me that I stood out from the crowd because they felt that I was being open and honest. 

Most girls (at least attractive young ones) don't take tinder seriously. Don't treat it like you're chatting up some cutie at a bar. It is not the same environment so why would the same things be applicable? 


You are an individual in a sea of dicks. You have to stand out. 


My current girlfriend suggested meeting me after I had a really personal conversation with her about mental health. She told me that me talking to her about that, opening up, was attractive. This is obviously a selection bias but don't you want someone that you can be open with. 


If you aren't vibing with someone, they don't get your jokes, they don't have anything interesting to say, move on. 


Also I have been reading around and seeing that dudes are talking to girls exclusively on tinder for weeks if not longer. Don't do this. Tinder has a shitty UX compared to other apps, and why would you want to talk to her on the platform where guys are constantly hitting her up and being gross. I'm sure most girls have a sort of negative association with tinder messages. and they also probably have notifications off. As soon as you have an extended conversation with the person, or short ones over a day or two, ask for snapchat or her number. Most people IME won't have a problem giving it out, and if they do that probably means they aren't interested. 


Being able to deeply connect with someone quickly is why I love tinder. You have a platform that has very low risk for expressing yourself. So do so. 

I am open to hearing feedback. 

Other people probably do tinder much better than me. Honestly I talk to most of my matches just to learn about personalities and their lives. ",catfish,post trying get laid honestly act like trying get laid mean sexual women deal constantly getting sexualized tinder save let sit face openers i mean seriously wtf even point that now know tinder stats generally play out reference matches ever used tinder way meet people got summer going th grade back minors could use it almost freshman uni i m super good looking guy bad either main downside skinny lbs used tinder number hookups multiple relationships it including current one happy about expert tinder see lot people hyping every interaction see producing positive outcome really comment tinder usage age group young people seems like main problem people overthink communicate matches limits finding really want tinder digital bar guys compete see suavest pickup line tinder exploring experimenting human psyche try things out experiment ask interesting entreating questions human experience open humble force interaction match feel need to opportunity meet many people otherwise would least me literally never life gone hit girl public party anything tinder way simulate that way circumvent it if act like thoughtful caring interesting person people like you tinder cast wide net live densely populated area should t hard get matches catfish someone also choose good pictures yourself getting foot door largest amount people personally generally right swiped everyone unmatched people interested in that s i m lazy really see purpose focusing heavily initial selections read algorithm may lower tinder elo profile whatever works best terms swiping heres piece advice could really give yourself know sounds cliche least intellectual person not saying i m intelligent like talking random shit small talk whether girl talk something completely different expected majority choose meet someone also found nearly every girl ever gotten know tinder told stood crowd felt open honest girls at least attractive young ones take tinder seriously treat like chatting cutie bar environment would things applicable individual sea dicks stand out current girlfriend suggested meeting really personal conversation mental health told talking that opening up attractive obviously selection bias want someone open with vibing someone get jokes anything interesting say move on also reading around seeing dudes talking girls exclusively tinder weeks longer this tinder shitty ux compared apps would want talk platform guys constantly hitting gross i m sure girls sort negative association tinder messages also probably notifications off soon extended conversation person short ones day two ask snapchat number people ime problem giving out probably means interested able deeply connect someone quickly love tinder platform low risk expressing yourself so open hearing feedback people probably tinder much better me honestly talk matches learn personalities lives,think lot guys got wrong my theory tinder use
235,New scam?,5,6,17/06/2016,"I keep getting a bunch of girls who tell me theyre here for one week, 8 days, two weeks that just flat out give me their number as soon as i give my opener. It seems pretty suspicious anyone else getting this?",scam,keep getting bunch girls tell theyre one week days two weeks flat give number soon give opener seems pretty suspicious anyone else getting this,new scam
236,Scam?,5,2,16/08/2016,"got sent a tindplus.club/u /randomname link

i'm new to tinder. is that a scam?",scam,got sent tindplus club you randomname link i m new tinder scam,scam
237,Tinder dead in 🇨🇭?,5,11,08/05/2018,"Hey folks

I was wondering since some time why in my homecountry only girs use Tinder who look like they are either scam, fake, advertising their social media (mostly IG) or from abroad and just for a short period of time in Switzerland. 

I also get VERY rarely a like. And when, no reply. Though, there are a ot of pretty girls around (mostly fakes?)

I was now two days in Germany travelling by train and I got ""easily"" three likes, and from the two I wrote, both replied ma back. Also the girls look much more local than in Switzerland. 

Also I'd like to mention that I get likes easily and start chattig is easy even in Switzerland, when I use the same profile pictures / Info but with other dating apps. (e.g. Badoo)

Can anybody relate to my situation?


",scam,hey folks wondering since time homecountry girs use tinder look like either scam fake advertising social media mostly ig abroad short period time switzerland also get rarely like when reply though ot pretty girls around mostly fakes two days germany travelling train got easily three likes two wrote replied back also girls look much local switzerland also i d like mention get likes easily start chattig easy even switzerland use profile pictures info dating apps eg badoo anybody relate situation,tinder dead
238,What a scam Tinder has become.,5,17,02/08/2020,The app recycles people. It shows you people you have already swiped. Probably just to make you spend likes more --> run out of likes faster --> buy gold,scam,app recycles people shows people already swiped probably make spend likes run likes faster buy gold,scam tinder become
239,Girl asking for my age and birthdate,5,5,03/12/2016,"Just matched with a girl and messaged her. She immediately asked how old I was. Then asked when my birthday was. I was suspicious so told her the wrong date, but I've matched with some girls who are really into astrology so I gave her the benefit of the doubt. 

So after I told her this info she stopped talking to me entirely. She hasn't unmatched me or anything but hasn't responded to my messages. 

Is this some form of phishing scheme? I'm not too concerned since I didn't tell her my actual birthdate, but is this some new way to steal an identity I should be wary of in the future?",phishing,matched girl messaged her immediately asked old was asked birthday was suspicious told wrong date i ve matched girls really astrology gave benefit doubt told info stopped talking entirely unmatched anything responded messages form phishing scheme i m concerned since tell actual birthdate new way steal identity wary future,girl asking age birthdate
240,Tinder says I have 25+ matches if I purchase tinder gold.,5,8,23/12/2017,"How accurate is that?

It used to say 5+ - 10+ now it says 25+ and I've only had it for 1 day.

Is this a scam to make me buy it? Or is it actually accurate?

Edit:
Sorry, I mean likes not matches.",scam,accurate that used say says i ve day scam make buy it actually accurate edit sorry mean likes matches,tinder says matches purchase tinder gold
241,Lowered my age..got more matches,5,8,22/01/2021,"Experiment here...used same photos and same info. I only changed my age (29 to 24) and got higher quality matches. 

Wasn’t planning on doing anything with them or getting my catfish on just an interesting observation.",catfish,experiment here used photos info changed age got higher quality matches wasnt planning anything getting catfish interesting observation,lowered age got matches
242,I 21m got a call from someone saying they were from tinder,5,8,19/09/2022,I 21m got a call from someone saying they was from tinder and they said. hello (my name) I’m from tinder and I wanted to ask you some questions about the last person you hooked up with and I’ve never hooked up with anyone from tinder. Is this a scam?,scam,m got call someone saying tinder said hello my name i am tinder wanted ask questions last person hooked ive never hooked anyone tinder scam,m got call someone saying tinder
243,"Have any of you had a really, really bad experience with Tinder?",5,10,24/10/2014,"Extreme examples would be getting Catfished, meeting up with an underage girl, girl trying to get herself pregnant, getting a STD, and getting raped/robbed. More common examples would probably just be a really bad date (this does not include having a boring date, and not getting laid). Who's got stories?",robbed,extreme examples would getting catfished meeting underage girl girl trying get pregnant getting std getting raped robbed common examples would probably really bad date this include boring date getting laid who s got stories,really really bad experience tinder
244,What are the different ways you can get scammed on tinder?,5,5,27/06/2020,"I'm getting a hang of it.

People who only upload a couple pictures and dont have their instagram on the bio or anything on the bio are a little suss

Anyone with snapchat on their bio are usually camgirls trying to scam you

People that put their instagrams on tinder seems to want to get free followers 

I had an elaborate scam where someone gave me their number, sent a bunch of nudes then asked for money.",scam,i m getting hang it people upload couple pictures dont instagram bio anything bio little suss anyone snapchat bio usually camgirls trying scam people put instagrams tinder seems want get free followers elaborate scam someone gave number sent bunch nudes asked money,different ways get scammed tinder
245,Girls first reply to my message was to ask to see my cock?,5,4,19/06/2014,"Is this normal on tinder? I said no, but considered saying you can see it, touch it, and feel it when we meet to keep convo going n assess situation more, but made decision to say no cos bottomline it could be anyone that receives it, could be some girl out cock pic collecting to put online etc or could be a catfish etc. But then she replied Ok. And I started thinking maybe what if she was a horny nympo dtf with no chase. Few girls in past few days have initiated sexual talk as their first reply to my opening message  but none ask for a cock pic.  ",catfish,normal tinder said no considered saying see it touch it feel meet keep convo going n assess situation more made decision say cos bottomline could anyone receives it could girl cock pic collecting put online etc could catfish etc replied ok started thinking maybe horny nympo dtf chase girls past days initiated sexual talk first reply opening message none ask cock pic,girls first reply message ask see cock
246,Tinder secret date?,5,8,17/06/2020,"I was messaging someone and things seemed to have flown oddly quick. Eventually after some dirty talk my match sent a link to a website called TinderSecretDate to get some sort of code. I am suspicious that this is an attempt to steal information, is this legit or a scam?",scam,messaging someone things seemed flown oddly quick eventually dirty talk match sent link website called tindersecretdate get sort code suspicious attempt steal information legit scam,tinder secret date
247,Did Tinder just “scam” me?,5,4,11/10/2021,"Ok i’m sure they didn’t but I thought I’d discuss this to see if anyones had a similar experience. 

I was scrolling through the deck and this super cute guy popped up and I swear I liked him because I was actively thinking “wow he’s cute” and I wasn’t swiping left or right, I was clicking the green yes button. I wasn’t speed running profiles either, I was taking my time. Then I got a notification saying “Oops! You missed a match.” And if it weren’t for that notification I wouldn’t have even known i swiped no.  So I clicked rewind and ended up paying the $8 for tinder plus and i went back to his profile and swiped right. It wasn’t even a match.

I always assumed that popped up when you swipe left on someone who swiped right on you, but I guess that presumption is wrong. It’s just odd. Any similar experiences?",scam,ok i am sure didnt thought id discuss see anyones similar experience scrolling deck super cute guy popped swear liked actively thinking wow hes cute wasnt swiping left right clicking green yes button wasnt speed running profiles either taking time got notification saying oops missed match werent notification wouldnt even known swiped no clicked rewind ended paying tinder plus went back profile swiped right wasnt even match always assumed popped swipe left someone swiped right you guess presumption wrong odd similar experiences,tinder scam me
248,Tinder has been a scam bait for me.,5,4,01/08/2021,"The only things I've found on Tinder a CryptoCurrency scammers, with Asian profiles of 30yo women posing as rich girls or just plain fake pictures.

I suppose what they try to is to do is to lure you in with the hopes of getting some couple hundred bucks out of you or to download some slimy suspicious app to ""invest"" in them.

Fuck me the world is rotten to the core.

And fuck you, scammers who read this.

Good luck for anyone who really wants to get a date, a relationship or just laid. It's a gruesome mind war field.",scam,things i ve found tinder cryptocurrency scammers asian profiles yo women posing rich girls plain fake pictures suppose try lure hopes getting couple hundred bucks download slimy suspicious app invest them fuck world rotten core fuck you scammers read this good luck anyone really wants get date relationship laid gruesome mind war field,tinder scam bait me
249,Have you ever reported a real user?,5,9,23/07/2015,"Just curious if anyone here has ever reported a real user OTHER than a catfish. If so, what was the reason?",catfish,curious anyone ever reported real user catfish so reason,ever reported real user
250,Tinder is a straight up scam,4,10,13/08/2021,"Im not gonna go into detail because there's too many of the little scammy tricks that they pull, but i wanna hear about what your experiences are with this dodgy app",scam,im gonna go detail there s many little scammy tricks pull wanna hear experiences dodgy app,tinder straight scam
251,Have you also met girls who try to persuade you to buy cryptocurrencies?,4,5,13/08/2021,"Since I installed Tinder, I met many girls that are trying to persuade me to send money to a weird and scam lookalike website, to buy buy “unlisted” cryptocurrencies. 

I have a least five profiles like this, that send me messages in a daily basis, and are constantly talking about trading and the earnings I am supposedly losing. 

They all are rather sexy, come from Singapore and use an UK number! WTF",scam,since installed tinder met many girls trying persuade send money weird scam lookalike website buy buy unlisted cryptocurrencies least five profiles like this send messages daily basis constantly talking trading earnings supposedly losing rather sexy come singapore use uk number wtf,also met girls try persuade buy cryptocurrencies
252,Can’t convert on dates,4,16,12/10/2021,"I really need help. I do pretty well on the app, and can usually land dates for the weekend pretty consistently, but I have absolutely no game.

I’m a 23m that went to a good school and have an adorable husky that I’m sure gets me a lot of extra matches. I’m decent at the small talk, but that’s really it.

I’ve only ever been in relationships from high school and college, and never really been the hookup type so I’m absolutely lost. 

I’m really not on tinder to find a girlfriend, I just want some casual hookups but I think I exude boyfriend vibes. 

It’s not that I’m awkward or seem like a catfish, because a good amount of these dates go well in the conventional sense (girl wanting more dates/continue to message frequently).

How do you guys approach things? I guess I’m just not good at the “you want to head back to my place?” Part of it (closing). Maybe it’s my first date location (usually coffee or something relating to their profile) or me just not being straightforward? I just don’t want to come off as a dick/creep but I really only want sex and not to invest 3+ dates.",catfish,really need help pretty well app usually land dates weekend pretty consistently absolutely game i am m went good school adorable husky i am sure gets lot extra matches i am decent small talk thats really it ive ever relationships high school college never really hookup type i am absolutely lost i am really tinder find girlfriend want casual hookups think exude boyfriend vibes i am awkward seem like catfish good amount dates go well conventional sense girl wanting dates continue message frequently guys approach things guess i am good want head back place part closing maybe first date location usually coffee something relating profile straightforward dont want come dick creep really want sex invest dates,cant convert dates
253,Does Tinder just give out likes when you make an account?,4,8,24/11/2021,So I just made an account and in like 3 hours I got 5 likes which I feel is a marketing scam kinda thing by Tinder so I pay to see who liked me? Did this happen to anyone else?,scam,made account like hours got likes feel marketing scam kin the thing tinder pay see liked me happen anyone else,tinder give likes make account
254,Scam on chat,4,15,15/10/2021,"Hi all, I'm not really used to Tinder and OLD. I started messaging with this guy on tinder, move on to Facebook to video call. Video was weird, we couldn't hear and of course I got nervous and close the call after 4 min or so. (Still too long ) anyway I tried to see if it was a scam, and it was, as he convinced me to recall and then asked me to remove glasses slowly to draw my eyes (wtf) . I blocked immediately.  Does anyone had a similar experience? I'm afraid they will use my video and my data to create a fake account, as they did with this guy I guess.",scam,hi all i m really used tinder old started messaging guy tinder move facebook video call video weird hear course got nervous close call min so still long anyway tried see scam was convinced recall asked remove glasses slowly draw eyes wtf blocked immediately anyone similar experience i m afraid use video data create fake account guy guess,scam chat
255,Anyone else running into this? (Scam?),4,10,21/04/2021,"So three times so far, I’ve matched with a girl. After like two texts they tell me they’re just looking for like a hookup or smoke buddy, and I say I’m down. After that they ask if I’m free right then and there. Obviously, concerned for my safety I say nah, but maybe later and I ask for like a number or snap and they immediately unmatch me. I can’t tell if they’re trying to scam me or rob me when I show up or something more malicious. Has anyone else run into this?",scam,three times far ive matched girl like two texts tell theyre looking like hookup smoke buddy say i am down ask i am free right there obviously concerned safety say nah maybe later ask like number snap immediately unmatch me cant tell theyre trying scam rob show something malicious anyone else run this,anyone else running this scam
256,Should I tell him I have gapped teeth?,4,14,13/06/2022,"Soo i recently matched with this cute guy and we’re planning to see each other tomorrow… 
I think I look pretty much like my pictures on tinder lol I’m not a catfish but it’s been 2 months since I had a palate expander and it created a gap between my two front teeth. I personally don’t like it and feel a bit insecure about it too. 
I was wondering if I should tell him before hand that my smile has changed (all the pics I put on my tinder are with my « old » original smile which I loved 🥲 anyways) or should I just not mention it and don’t say anything during the date? 

I know it might sound like a bit of a dumb question but having gapped teeth is a big change for me hahaha and I’m not lovin it lemme tell you.
Thanks for your help!!",catfish,soo recently matched cute guy planning see tomorrow think look pretty much like pictures tinder lol i am catfish months since palate expander created gap two front teeth personally dont like feel bit insecure too wondering tell hand smile changed all pics put tinder old original smile loved anyways mention dont say anything date know might sound like bit dumb question gapped teeth big change hahaha i am lovin lemme tell you thanks help,tell gapped teeth
257,Massage Scams somehow getting their profiles verified,4,1,10/09/2021,"Just a heads up, everyone has probably seen the old massage scam. Usually a profile of a hot girl offering ""massage therapy"" for very low prices. Usually has something along the lines of ""set my prices low to meet people nearby"" and posting their snapchat. 

Now it seems these profiles are getting verified so just wanting to let everyone know as usual to report these.",scam,heads up everyone probably seen old massage scam usually profile hot girl offering massage therapy low prices usually something along lines set prices low meet people nearby posting snapchat seems profiles getting verified wanting let everyone know usual report these,massage scams somehow getting profiles verified
